,ID,EN,CZ,EN_tokens,CZ_tokens
218,218,"The present contribution is an updated and extended version of the paper from the conference DepLing 2011. It represents the first step in comparing the nature of syntactico-semantic relations present in the sentence structure to their equivalents in the discourse structure. The study is carried out on the basis of a Czech manually annotated material collected in the Prague Dependency Treebank (PDT). According to the analysis of the underlying syntactic structure of a sentence (tectogrammatics) in the PDT, we distinguish various types of relations that can be expressed both within a single sentence (i.e. in a tree) and in a larger text, beyond the sentence boundary (between trees). We suggest that, on the one hand, semantic nature of each type of these relations corresponds both within a sentence and in a larger text (i.e. a causal relation remains a causal relation) but, on the other hand, according to the semantic properties of the relations, their distribution in a sentence or between sentences is very diverse. In this study, this observation is analyzed in detail for three cases (relations of condition, specification and opposition) and further supported by similar behaviour of the English data from the Penn Discourse Treebank.","Článek je aktualizovanou a rozšířenou verzí článku z konference DepLing 2011. Reprezentuje první krok v porovnání vlastností syntakticko-sémantických vztahů přítomných ve struktuře věty a jejich ekvivalentů ve struktuře diskurzu. Studie byla provedena na ručně anotovaných datech Pražského závislostního korpusu (PDT). Podle analýzy podkladové syntaktické struktury věty (tektogramatiky) v PDT rozlišujeme řadu typů vztahů, které mohou být vyjádřeny jak v jedné větě (tj. ve stromu), tak i v delším textu, napříč hranicemi vět (mezi stromy). Tvrdíme, že tyto vztahy na jednu stranu zachovávají své sémantické vlastnosti jak uvnitř věty, tak v delším textu (např. příčinný vztah zůstává příčinným vztahem), na druhou stranu ale v souladu se sémantickými vlastnostmi vztahů je jejich distribuce uvnitř vět či mezi větami velice rozličná. V této studii toto pozorování ověřujeme na třech případech (na podmínkovém, specifikačním a opozičním vztahu) a dokládáme podobným chováním anglických dat projektu Penn Discourse Treebank.","['present', 'contribut', 'updat', 'extend', 'version', 'paper', 'confer', 'depl', 'repres', 'first', 'step', 'compar', 'natur', 'relat', 'present', 'sentenc', 'structur', 'equival', 'discours', 'structur', 'studi', 'carri', 'basi', 'czech', 'manual', 'annot', 'materi', 'collect', 'pragu', 'depend', 'treebank', 'pdt', 'accord', 'analysi', 'underli', 'syntact', 'structur', 'sentenc', 'tectogrammat', 'pdt', 'distinguish', 'variou', 'type', 'relat', 'express', 'within', 'singl', 'sentenc', 'tree', 'larger', 'text', 'beyond', 'sentenc', 'boundari', 'tree', 'suggest', 'one', 'hand', 'semant', 'natur', 'type', 'relat', 'correspond', 'within', 'sentenc', 'larger', 'text', 'causal', 'relat', 'remain', 'causal', 'relat', 'hand', 'accord', 'semant', 'properti', 'relat', 'distribut', 'sentenc', 'sentenc', 'divers', 'studi', 'observ', 'analyz', 'detail', 'three', 'case', 'relat', 'condit', 'specif', 'opposit', 'support', 'similar', 'behaviour', 'english', 'data', 'penn', 'discours', 'treebank']","['aktualizovan', 'rozšířen', 'verz', 'konferenk', 'depling', 'reprezentuj', 'krok', 'porovnán', 'vlastnost', 'vztah', 'přítomn', 'struktuř', 'vět', 'ekvivalent', 'struktuř', 'diskurz', 'studi', 'proveden', 'ručn', 'anotovan', 'dat', 'pražsk', 'závislostn', 'korpus', 'pdt', 'analýz', 'podklad', 'syntaktick', 'struktur', 'vět', 'tektogramatik', 'pdt', 'rozlišujem', 'řad', 'typ', 'vztah', 'vyjádřen', 'jedn', 'vět', 'tj', 'strom', 'del', 'text', 'napříč', 'hranik', 'vět', 'strom', 'tvrdím', 'vztah', 'jedn', 'stran', 'zachovávaj', 'sémantick', 'vlastnost', 'uvnitř', 'vět', 'del', 'text', 'příčinn', 'vztah', 'zůstáv', 'příčinn', 'vztah', 'druh', 'stran', 'soulad', 'sémantick', 'vlastnost', 'vztah', 'distribuk', 'uvnitř', 'vět', 'vět', 'velik', 'rozličn', 'studi', 'pozorován', 'ověřujem', 'třech', 'případ', 'podmínko', 'specifikač', 'opozič', 'vztah', 'dokládám', 'podobn', 'chová', 'anglick', 'dat', 'projekt', 'penn', 'discours', 'treebank']"
219,219,"A report from the 25th European Summer School in Logic, Language and Information in Düsseldorf. ","Zpráva z 25. ročníku evropské letní školy logiky, jazyka a informace v Düsseldorfu.","['report', '25th', 'european', 'summer', 'school', 'logic', 'languag', 'inform', 'düsseldorf']","['zpráv', 'ročník', 'evropsk', 'letn', 'škol', 'logik', 'jazyk', 'informak', 'düsseldorf']"
220,220,This talk is focused on automatioc swear words detection in sentiment analysis. We outline swear words categorization and describe basic strategies when creating new vulgarisms within online communication.,"Příspěvek je věnován automatické detekci vulgarismů, tj. význačných indikátorů negativního hodnocení, v rámci postojové analýzy. Zaměříme se na význam a kategorizaci vulgarismů a především popíšeme základní strategie při vytváření nových vulgarismů v internetové komunikaci, od přidávání nepísmenných znaků přes záměnu písmen po užívání speciálních zkratek a výrazů na pomezí argotu. Dále navrhneme základní řešení pro automatické zpracování těchto slov. ","['talk', 'focus', 'automatioc', 'swear', 'word', 'detect', 'sentiment', 'analysi', 'outlin', 'swear', 'word', 'categor', 'describ', 'basic', 'strategi', 'creat', 'new', 'vulgar', 'within', 'onlin', 'commun']","['příspěvek', 'věnován', 'automatick', 'detekk', 'vulgarism', 'tj', 'význačn', 'indikátor', 'negativn', 'hodnocen', 'rámk', 'postoj', 'analýz', 'zaměřím', 'význam', 'kategorizak', 'vulgarism', 'předev', 'popíšem', 'základn', 'strategi', 'vytvářen', 'nov', 'vulgarism', 'internet', 'komunikak', 'přidáván', 'nepísmenn', 'znak', 'záměn', 'písmen', 'užíván', 'speciáln', 'zkratek', 'výraz', 'pomez', 'argot', 'navrhnem', 'základn', 'řešen', 'automatick', 'zpracován', 'těcht', 'slov']"
221,221,"In this paper, we introduce the Visual History Archive of the USC Shoah Foundation as a multimodal data resource for sentiment analysis in Czech, but potentially all thirty three languages it contains. We take the opportunity of having both physical access to these unique data and the well-established research group on sentiment analysis at Charles University in Prague. Our aim is to provide methodology for sentiment annotation of these multimodal data combining subjectivity detection within a treebank with spoken term detection.","V článku představujeme Archiv vizuální historie MALACH jako multimodální zdroj dat pro postojovou analýzu v češtině, případně v dalších jazycích, které archiv obsahuje.","['paper', 'introduc', 'visual', 'histori', 'archiv', 'usc', 'shoah', 'foundat', 'multimod', 'data', 'resourc', 'sentiment', 'analysi', 'czech', 'potenti', 'thirti', 'three', 'languag', 'contain', 'take', 'opportun', 'physic', 'access', 'uniqu', 'data', 'research', 'group', 'sentiment', 'analysi', 'charl', 'univers', 'pragu', 'aim', 'provid', 'methodolog', 'sentiment', 'annot', 'multimod', 'data', 'combin', 'subject', 'detect', 'within', 'treebank', 'spoken', 'term', 'detect']","['představujem', 'archiv', 'vizuáln', 'histori', 'malach', 'multimodáln', 'zdroj', 'dat', 'postoj', 'analýz', 'česk', 'případn', 'dalš', 'jazyc', 'archiv', 'obsahuj']"
222,222,"This survey serves as an illustration of equalization tendency in typologically different languages, using constructional analysis of structures containing adcollocational verbal idioms.",Tento výzkum rozvíjí myšlenku ekvikomplexity typologicky odlišných jazyků za pomocí konstrukční analýzy struktur obsahujících adkolokační verbální idiomy.,"['survey', 'serv', 'illustr', 'equal', 'tendenc', 'typolog', 'differ', 'languag', 'use', 'construct', 'analysi', 'structur', 'contain', 'adcolloc', 'verbal', 'idiom']","['výzkum', 'rozvíj', 'myšlenk', 'ekvikomplexit', 'typologick', 'odlišn', 'jazyk', 'pomoc', 'konstrukčn', 'analýz', 'struktur', 'obsahujíc', 'adkolokačn', 'verbáln', 'idiom']"
223,223,"In this paper we present a preliminary research into the linguistic structure of evaluative meaning in Czech. We describe the ways the evaluative meaning is modelled in Czech using means from different layers of linguistic description, mainly morphology. Moreover, we use the construction grammar framework (see Fried and Östman 2004) to capture evaluative sentences and to depict the relationship between structure, meaning and use of evaluative expressions in language, joining the growing body of constructional research concerning the expressions of subjective judgement, broadly defined (e.g. Matsumoto 2008, Fried and Östman 2009, Terkourafi 2010). ","Předběžný výzkum struktury evaluativního významu v češtině. Popisujeme způsoby, jakými je evaluativní význam modelován na různých úrovních popisu jazyka, především však na rovině morfologické. Při formalizaci využíváme konstrukčně-gramatického formalismu.","['paper', 'present', 'preliminari', 'research', 'linguist', 'structur', 'evalu', 'mean', 'czech', 'describ', 'way', 'evalu', 'mean', 'model', 'czech', 'use', 'mean', 'differ', 'layer', 'linguist', 'descript', 'mainli', 'morpholog', 'moreov', 'use', 'construct', 'grammar', 'framework', 'see', 'fri', 'östman', 'captur', 'evalu', 'sentenc', 'depict', 'relationship', 'structur', 'mean', 'use', 'evalu', 'express', 'languag', 'join', 'grow', 'bodi', 'construct', 'research', 'concern', 'express', 'subject', 'judgement', 'broadli', 'defin', 'matsumoto', 'fri', 'östman', 'terkourafi']","['předběžn', 'výzkum', 'struktur', 'evaluativn', 'význam', 'česk', 'popisujem', 'způsob', 'jak', 'evaluativn', 'význam', 'modelován', 'různ', 'úrovn', 'popis', 'jazyk', 'předev', 'rovin', 'morfologick', 'formalizak', 'využívám', 'formalism']"
224,224,"In this talk we focus on sentiment analysis, i.e. linguistic analysis of emotions and opinions expressed in speech or in text.","V přednášce se zaměříme na problematiku postojové analýzy, tedy lingvistického zkoumání emocí, názorů a postojů vyjádřených v textu nebo v řeči. Shrneme dosavadní bádání v oboru a zaměříme se na jednotlivé aspekty vyjadřování emocí: na stránku lexikální (slovník hodnotících výrazů pro češtinu, evaluativní idiomy), gramatickou (význam jednotlivých slovních druhů, typické syntaktické vzorce hodnotících vět) a především sémantickou a pragmatickou. Dále představíme dostupné aplikace vycházející z postojové analýzy a nastíníme problémy a výzvy, které jsou v této disciplíně aktuální – např. automatická detekce cílů hodnocení či zapojení nadvětné syntaxe.","['talk', 'focu', 'sentiment', 'analysi', 'linguist', 'analysi', 'emot', 'opinion', 'express', 'speech', 'text']","['přednášk', 'zaměřím', 'problematik', 'postoj', 'analýz', 'lingvistick', 'zkoumán', 'emoc', 'názor', 'postoj', 'vyjádřen', 'text', 'řek', 'shrnem', 'dosavadn', 'bádán', 'obor', 'zaměřím', 'jednotliv', 'aspekt', 'vyjadřován', 'emoc', 'stránk', 'lexikáln', 'slovník', 'hodnotíc', 'výraz', 'česk', 'evaluativn', 'idiom', 'gramatick', 'význam', 'jednotliv', 'slovn', 'druh', 'typick', 'syntaktick', 'vzork', 'hodnotíc', 'vět', 'předev', 'sémantick', 'pragmatick', 'představím', 'dostupn', 'aplikak', 'vycházejíc', 'postoj', 'analýz', 'nastíním', 'problém', 'výzv', 'disciplín', 'aktuáln', 'automatick', 'detekk', 'cíl', 'hodnocen', 'zapojen', 'nadvětn', 'syntax']"
225,225,"The talk was dedicated to syntactic position of non-conguent attribute expressed by a noun in genitive, including categorization based on PDT data.","Příspěvek byl věnován problematice neshodného genitivního přívlastku, konkrétně možnostem jeho pronikání do antepozice. V hlavní části jsme se věnovali kategorizaci neshodných genitivních přívlastků vyskytujících se v antepozici na datech z PDT.","['talk', 'dedic', 'syntact', 'posit', 'attribut', 'express', 'noun', 'genit', 'includ', 'categor', 'base', 'pdt', 'data']","['příspěvek', 'věnován', 'problematik', 'neshodn', 'genitivn', 'přívlastk', 'konkrétn', 'možnost', 'pronikán', 'antepozik', 'hlavn', 'část', 'věnoval', 'kategorizak', 'neshodn', 'genitivn', 'přívlastk', 'vyskytujíc', 'antepozik', 'dat', 'pdt']"
226,226,"This contribution describes improvements of opinion target identification in sentiment analysis, employing methods from quantitative linguistics, namely thematic concentration of the text.","Příspěvek popisuje možnosti vylepšení automatické detekce hodnocených entit v rámci postojové analýzy za využití metod kvantitativní lingvistiky, přesněji tematické koncentrace textu. ","['contribut', 'describ', 'improv', 'opinion', 'target', 'identif', 'sentiment', 'analysi', 'employ', 'method', 'quantit', 'linguist', 'name', 'themat', 'concentr', 'text']","['příspěvek', 'popisuj', 'možnost', 'vylepšen', 'automatick', 'detekk', 'hodnocen', 'entit', 'rámk', 'postoj', 'analýz', 'využit', 'metod', 'kvantitativn', 'lingvistik', 'přesněj', 'tematick', 'koncentrak', 'text']"
227,227,"The aim of this paper is to introduce the Czech subjectivity lexicon, a new lexical resource for sentiment analysis in Czech. We describe particular stages of the manual refinement of the lexicon and demonstrate its use in the state-of-the-art polarity classifiers, namely the Maximum Entrophy classifier. We test the success rate of the system enriched with the dictionary on different data sets, compare the results and suggest some further improvements of the lexicon-based classification system. ","Cílem tohoto článku je představit Czech subjectivity lexicon, nový lexikální zdroj pro analýzu sentimentu v češtině. Popisujeme jednotlivé fáze manuálních úprav slovníku a demonstrujeme jeho využití při klasifikaci polarity, respektive pro trénování Maximum Entrophy klasifikátoru. Úspěšnost klasifikátoru obohaceného o slovník testujeme na několika datasetech. Na základě výsledků navrhujeme vylepšení stávajícího systému.","['aim', 'paper', 'introduc', 'czech', 'subject', 'lexicon', 'new', 'lexic', 'resourc', 'sentiment', 'analysi', 'czech', 'describ', 'particular', 'stage', 'manual', 'refin', 'lexicon', 'demonstr', 'use', 'polar', 'classifi', 'name', 'maximum', 'entrophi', 'classifi', 'test', 'success', 'rate', 'system', 'enrich', 'dictionari', 'differ', 'data', 'set', 'compar', 'result', 'suggest', 'improv', 'classif', 'system']","['cíl', 'představit', 'czech', 'subjectivit', 'lexicon', 'lexikáln', 'zdroj', 'analýz', 'sentiment', 'česk', 'popisujem', 'jednotliv', 'fáh', 'manuáln', 'úprav', 'slovník', 'demonstrujem', 'využit', 'klasifikak', 'polarit', 'respektiv', 'trénován', 'maximum', 'entroph', 'klasifikátor', 'úspěšnost', 'klasifikátor', 'obohacen', 'slovník', 'testujem', 'několik', 'dataset', 'základ', 'výsledk', 'navrhujem', 'vylepšen', 'stávajíc', 'syst']"
228,228,"Although sentiment analysis has been gaining a booming interest recently, most experiments use only plain text corpora. This poster shows that an existing richly annotated Prague Dependency Treebank can be exploited as a source of valuable information important for various opinion mining subtasks. ","Přestože je postojová analýza široce zkoumaným odvětvím, většina výzkumu probíhá na prostém textu. Tento poster ukazuje využití závislostních dat z PDT pro nejrůznější úlohy v rámci opinion miningu. ","['although', 'sentiment', 'analysi', 'gain', 'boom', 'interest', 'recent', 'experi', 'use', 'plain', 'text', 'corpora', 'poster', 'show', 'exist', 'richli', 'annot', 'pragu', 'depend', 'treebank', 'exploit', 'sourc', 'valuabl', 'inform', 'import', 'variou', 'opinion', 'mine', 'subtask']","['přestoh', 'postoj', 'analýz', 'širok', 'zkouman', 'odvět', 'větš', 'výzkum', 'probíh', 'pros', 'text', 'poster', 'ukazuj', 'využit', 'závislostn', 'dat', 'pdt', 'nejrůznějš', 'úloh', 'rámk', 'opinion', 'mining']"
229,229,"In this paper, we describe and generalize syntactic patterns of structures containing opinion targets, i.e. evaluated entities, taking into account their semantic properties.",V příspěvku popisujeme generalizované vzorce výskytu postojových cílů (opinion targets) v evaluativních konstrukcích.,"['paper', 'describ', 'gener', 'syntact', 'pattern', 'structur', 'contain', 'opinion', 'target', 'evalu', 'entiti', 'take', 'account', 'semant', 'properti']","['příspěvk', 'popisujem', 'generalizovan', 'vzork', 'výskyt', 'postoj', 'cíl', 'opinion', 'targets', 'evaluativn', 'konstrukc']"
230,230,"This paper describes our submission to SemEval 2014 Task 41 (aspect based sentiment analysis). The current work is based on the assumption that it could be advantageous to connect the subtasks into one workflow, not necessarily following their given order. We took part in all four subtasks (aspect term extraction, aspect term polarity, aspect category detection, aspect category polarity), using polarity items detection via various subjectivity lexicons and employing a rule-based system applied on dependency data. To determine aspect categories, we simply look up their WordNet hypernyms. For such a basic method using no machine learning techniques, we consider the results rather satisfactory.","Článek popisuje systém pro automatickou extrakci hodnocených cílů, se kterým jsme se zúčastnili soutěže SemEval 2014. Systém je pravidlový, bez zapojení strojového učení, přesto však dosahuje relativně dobrých výsledků.","['paper', 'describ', 'submiss', 'semev', 'task', 'aspect', 'base', 'sentiment', 'analysi', 'current', 'work', 'base', 'assumpt', 'could', 'advantag', 'connect', 'subtask', 'one', 'workflow', 'necessarili', 'follow', 'given', 'order', 'took', 'part', 'four', 'subtask', 'aspect', 'term', 'extract', 'aspect', 'term', 'polar', 'aspect', 'categori', 'detect', 'aspect', 'categori', 'polar', 'use', 'polar', 'item', 'detect', 'via', 'variou', 'subject', 'lexicon', 'employ', 'system', 'appli', 'depend', 'data', 'determin', 'aspect', 'categori', 'simpli', 'look', 'wordnet', 'hypernym', 'basic', 'method', 'use', 'machin', 'learn', 'techniqu', 'consid', 'result', 'rather', 'satisfactori']","['popisuj', 'sys', 'automatick', 'extrakk', 'hodnocen', 'cíl', 'kter', 'zúčastnil', 'soutěh', 'semeval', 'sys', 'pravidl', 'zapojen', 'stroj', 'učen', 'přest', 'dosahuj', 'relativn', 'dobr', 'výsledk']"
231,231,"In this paper, we show some properties of function words in dependency trees. Function words are grammatical words, such as articles, prepositions, pronouns, conjunctions, or auxiliary verbs. These words are often short and very frequent in texts and therefore many of them can be easily recognized. We formulate a hypothesis that function words tend to have a fixed number of dependents and we prove this hypothesis on treebanks. Using this hypothesis, we are able to improve unsupervised dependency parsing and outperform previously published state-of-the-art results for many languages. ",Používání funkčních slov v neřízeném závislostním parsingu. Používání funkčních slov v neřízeném závislostním parsingu.,"['paper', 'show', 'properti', 'function', 'word', 'depend', 'tree', 'function', 'word', 'grammat', 'word', 'articl', 'preposit', 'pronoun', 'conjunct', 'auxiliari', 'verb', 'word', 'often', 'short', 'frequent', 'text', 'therefor', 'mani', 'easili', 'recogn', 'formul', 'hypothesi', 'function', 'word', 'tend', 'fix', 'number', 'depend', 'prove', 'hypothesi', 'treebank', 'use', 'hypothesi', 'abl', 'improv', 'unsupervis', 'depend', 'pars', 'outperform', 'previous', 'publish', 'result', 'mani', 'languag']","['používán', 'funkčn', 'slov', 'neříze', 'závislost', 'parsing', 'používán', 'funkčn', 'slov', 'neříze', 'závislost', 'parsing']"
232,232,"When deploying a spoken dialogue system in a new domain, one faces a situation where little to no data is available to train domain-specific statistical models. We describe our experience with bootstrapping a dialogue system for public transit and weather information in real-word deployment under public use. We proceeded incrementally, starting from a minimal system put on a toll-free telephone number to collect speech data. We were able to incorporate statistical modules trained on collected data – in-domain speech recognition language models and spoken language understanding – while simultaneously extending the domain, making use of automatically generated semantic annotation. Our approach shows that a successful system can be built with minimal effort and no in-domain data at hand.","Při nasazování dialogového systému pro novou doménu je nutné se vypořádat s nedostatkem trénovacích dat pro doménově specifické statistické modely. V tomto článku popisujeme své zkušenosti s vytvářením dialogového systému pro informace o veřejné dopravě a počasí přímo za provozu s uživateli z řad veřejnosti. Postupovali jsme inkrementálně od minimálního systému, který byl nasazen na bezplatné telefonní číslo ke sběru řečových dat. Na získaných datech jsme byli schopni natrénovat statistické modely – doménové jazykové modely pro rozpoznávání řeči a model pro porozumění jazyku, který používá automaticky generovanou sémantickou anotaci. Náš postup ukazuje, že úspěšný systém lze postavit i s minimálním úsilím a bez předem dostupných trénovacích dat pro danou doménu.","['deploy', 'spoken', 'dialogu', 'system', 'new', 'domain', 'one', 'face', 'situat', 'littl', 'data', 'avail', 'train', 'statist', 'model', 'describ', 'experi', 'bootstrap', 'dialogu', 'system', 'public', 'transit', 'weather', 'inform', 'deploy', 'public', 'use', 'proceed', 'increment', 'start', 'minim', 'system', 'put', 'telephon', 'number', 'collect', 'speech', 'data', 'abl', 'incorpor', 'statist', 'modul', 'train', 'collect', 'data', 'speech', 'recognit', 'languag', 'model', 'spoken', 'languag', 'understand', 'simultan', 'extend', 'domain', 'make', 'use', 'automat', 'gener', 'semant', 'annot', 'approach', 'show', 'success', 'system', 'built', 'minim', 'effort', 'data', 'hand']","['nasazován', 'dialog', 'syst', 'nov', 'domén', 'nutn', 'vypořád', 'nedostatk', 'trénovac', 'dat', 'domén', 'specifick', 'statistick', 'model', 'popisujem', 'zkušenost', 'vytváře', 'dialog', 'syst', 'informak', 'veřejn', 'doprav', 'počas', 'přím', 'provoz', 'uživatel', 'řad', 'veřejnost', 'postupoval', 'inkrementáln', 'minimáln', 'syst', 'nasazen', 'bezplatn', 'telefonn', 'čísl', 'sběr', 'řečov', 'dat', 'získan', 'dat', 'schopn', 'natrén', 'statistick', 'model', 'domén', 'jazyk', 'model', 'rozpoznáván', 'řek', 'model', 'porozuměn', 'jazyk', 'použív', 'automatick', 'generovan', 'sémantick', 'anotak', 'postup', 'ukazuj', 'úspěšn', 'sys', 'lze', 'postavit', 'minimál', 'úsi', 'před', 'dostupn', 'trénovac', 'dat', 'dan', 'domén']"
