,ID,EN,CZ,EN_tokens,CZ_tokens
63,63,"Malach Center for Visual History (Malach CVH) at the Faculty of Mathematics and Physics of the Charles University in Prague provides local access to the extensive digital archives of the USC Shoah Foundation – the Institute for Visual history and Education, the Refugee Voices archive of the Association of Jewish Refugees, and other archives of oral histories. The Visual History Archive of USC Shoah Foundation contains over 53 000 witness testimonies covering the history of entire 20th century. The Refugee Voices archive complements this collection with additional 150 interviews, conducted in English language by Association of Jewish Refugees in United Kingdom. Generally speaking, oral history interviews are valuable information resource for students and researchers in many disciplines. Secondary analysis of the testimonies is also applicable to many different scientific fields besides historiography and genocide studies. This paper provides a brief overview and description of available data, and it presents some of the more recent research and educational activities facilitated by the existence of Malach CVH in the Czech Republic.",Článek představuje digitální orálněhistorické sbírky dostupné uživatelům CVH Malach a příklady badatelského a vzdělávacího využití těchto materiálů.,"['malach', 'center', 'visual', 'histori', 'malach', 'cvh', 'faculti', 'mathemat', 'physic', 'charl', 'univers', 'pragu', 'provid', 'local', 'access', 'extens', 'digit', 'archiv', 'usc', 'shoah', 'foundat', 'institut', 'visual', 'histori', 'educ', 'refuge', 'voic', 'archiv', 'associ', 'jewish', 'refuge', 'archiv', 'oral', 'histori', 'visual', 'histori', 'archiv', 'usc', 'shoah', 'foundat', 'contain', 'wit', 'testimoni', 'cover', 'histori', 'entir', '20th', 'centuri', 'refuge', 'voic', 'archiv', 'complement', 'collect', 'addit', 'interview', 'conduct', 'english', 'languag', 'associ', 'jewish', 'refuge', 'unit', 'kingdom', 'gener', 'speak', 'oral', 'histori', 'interview', 'valuabl', 'inform', 'resourc', 'student', 'research', 'mani', 'disciplin', 'secondari', 'analysi', 'testimoni', 'also', 'applic', 'mani', 'differ', 'scientif', 'field', 'besid', 'historiographi', 'genocid', 'studi', 'paper', 'provid', 'brief', 'overview', 'descript', 'avail', 'data', 'present', 'recent', 'research', 'educ', 'activ', 'facilit', 'exist', 'malach', 'cvh', 'czech', 'republ']","['představuj', 'digitáln', 'orálněhistorick', 'sbírk', 'dostupn', 'uživatel', 'cvh', 'malach', 'příklad', 'badatelsk', 'vzdělávac', 'využit', 'těcht', 'materiál']"
64,64,"The article describes the latest addition into USC Shoah Foundation's Visual History Archive, which is the collection of interviews with witnesses and survivors of Armenian genocide. The text deals with the characteristics of the collection as well as its specific features in the context of VHA.","Zpráva popisuje poslední přírůstek v Archivu vizuální historie USC Shoah Foundation, kolekci rozhovorů se svědky a přeživšími genocidy Arménů, která je dostupná od dubna 2015 i v CVH Malach. Pojednáno je o charakteristikách kolekce i o jejích specificích v rámci celého Archivu USC SF.","['articl', 'describ', 'latest', 'addit', 'usc', 'shoah', 'foundat', 'visual', 'histori', 'archiv', 'collect', 'interview', 'wit', 'survivor', 'armenian', 'genocid', 'text', 'deal', 'characterist', 'collect', 'well', 'specif', 'featur', 'context', 'vha']","['zpráv', 'popisuj', 'posledn', 'přírůstek', 'archiv', 'vizuáln', 'histori', 'usc', 'shoah', 'foundation', 'kolekk', 'rozhovor', 'svědk', 'přeživš', 'genocid', 'armén', 'dostupn', 'dubn', 'cvh', 'malach', 'pojednán', 'charakteristik', 'kolekk', 'jej', 'specific', 'rámk', 'cel', 'archiv', 'usc', 'sf']"
65,65,"DeriNet, a new database of lexical derivates, is being developed at the Institute of Formal and Applied Linguistics. Since it is a wordnet containing large amounts of trees, it is hard to visualize, search and extend without specialized tools. This paper describes a program which has been developed to display the trees and enable finding certain types of errors, and its query language. The application is web-based for ease of use and access. The language has been inspired by CQL, the language used for searching the Czech National Corpus, and uses similar key-words and syntax extended to facilitate searching in tree structures.","DeriNet je databáze lexikálních derivátů vyvíjená v Ústavu formální a aplikované lingvistiky. Takovou síť vztahů s velkým počtem derivačních stromů je těžké vizualizovat. V tomto článku popisujeme softwarový nástroj, který byl vyvinut za účelem zobrazování a prohledávání derivačních stromů. Nástroj má formu webové aplikace a využívá nově vyvinutý dotazovací jazyk podobný jazyku CQL, který se používá k prohledávání Českého národního korpusu.","['derinet', 'new', 'databas', 'lexic', 'deriv', 'develop', 'institut', 'formal', 'appli', 'linguist', 'sinc', 'wordnet', 'contain', 'larg', 'amount', 'tree', 'hard', 'visual', 'search', 'extend', 'without', 'special', 'tool', 'paper', 'describ', 'program', 'develop', 'display', 'tree', 'enabl', 'find', 'certain', 'type', 'error', 'queri', 'languag', 'applic', 'eas', 'use', 'access', 'languag', 'inspir', 'cql', 'languag', 'use', 'search', 'czech', 'nation', 'corpu', 'use', 'similar', 'syntax', 'extend', 'facilit', 'search', 'tree', 'structur']","['derinet', 'databáh', 'lexikáln', 'derivát', 'vyvíjen', 'ústav', 'formáln', 'aplikovan', 'lingvistik', 'takov', 'síť', 'vztah', 'velk', 'počt', 'derivačn', 'strom', 'těžk', 'vizualiz', 'popisujem', 'softwar', 'nástroj', 'vyvinut', 'účel', 'zobrazován', 'prohledáván', 'derivačn', 'strom', 'nástroj', 'form', 'web', 'aplikak', 'využív', 'nov', 'vyvinut', 'dotazovac', 'jazyk', 'podobn', 'jazyk', 'cql', 'použív', 'prohledáván', 'česk', 'národn', 'korpus']"
66,66,The lexical network DeriNet 1.0 captures core word-formation relations on the set of lemmas stored in the morphological lexicon Morflex.,DeriNet 1.0 je lexikální síť zahrnující informace o lemmatech obsažených v morfologickém slovníku Morflex.,"['lexic', 'network', 'derinet', 'captur', 'core', 'relat', 'set', 'lemma', 'store', 'morpholog', 'lexicon', 'morflex']","['derinet', 'lexikáln', 'síť', 'zahrnujíc', 'informak', 'lemm', 'obsažen', 'morfologic', 'slovník', 'morflex']"
67,67,"We present the methodology and results of a survey on the annotation of multiword expressions in treebanks. The survey was conducted using a wiki-like website filled out by people knowledgeable about various treebanks. The survey results were studied with a comparative focus on prepositional MWEs, verb-particle constructions and multiword named entities.","Představujeme metologii a výsledky průzkumu anotace víceslovných výrazů v treebancích. Průzkum probíhal pomocí webu na principu wiki, kam přispívali lidé obeznámení s treebanky. Výsledky průzkumu jsme studovali zejména z hlediska porovnání přístupů k předložkovým víceslovným výrazům, slovesným konstrukcím s předložkou a víceslovným pojmenovaným entitám.","['present', 'methodolog', 'result', 'survey', 'annot', 'multiword', 'express', 'treebank', 'survey', 'conduct', 'use', 'websit', 'fill', 'peopl', 'knowledg', 'variou', 'treebank', 'survey', 'result', 'studi', 'compar', 'focu', 'preposit', 'mwe', 'construct', 'multiword', 'name', 'entiti']","['představujem', 'metologi', 'výsledk', 'průzkum', 'anotak', 'víceslovn', 'výraz', 'treebanc', 'průzkum', 'probíhal', 'pomoc', 'web', 'princip', 'wik', 'přispíval', 'lid', 'obeznámen', 'treebank', 'výsledk', 'průzkum', 'studoval', 'zejmén', 'hledisk', 'porovnán', 'přístup', 'předložk', 'víceslovn', 'výraz', 'slovesn', 'konstruk', 'předložk', 'víceslovn', 'pojmenovan', 'entit']"
68,68,"In the presentation, the general overview of textual phenomena annotated in the Prague Dependency treebank is presented. We discuss coreference, reconstruction of ellises, topic-focus articulation and discourse structure. ","Prezentace popisuje textove jevy zachycene v tektogramaticke anotace PDT - koreference, elipsy, aktualni cleneni a diskurz.","['present', 'gener', 'overview', 'textual', 'phenomena', 'annot', 'pragu', 'depend', 'treebank', 'present', 'discuss', 'corefer', 'reconstruct', 'ellis', 'articul', 'discours', 'structur']","['prezentak', 'popisuj', 'text', 'jev', 'zachycen', 'tektogramatick', 'anotak', 'pdt', 'koreferenk', 'elips', 'aktualn', 'clenen', 'diskurz']"
69,69,"The talk presents manual annotation of coreference relations in more detail: coreference resolution experiments, manual annotation of English (Ontonotes vs. PCEDT, problematic cases (generics, premodifiers, etc.)), (dis)agreements, coreference chains in Czech, English and Russian.","V teto prednasce se zamerime na detailnejsi popis koreference v cestine. predstavim proces anotace, vysledky automatickeho rozreseni koreference a srovname to s vysledky mezianotatorske shody. Zamerime se taky na oreferencni retezce a jejich reprezentace v cestine a jinych jazycich.","['talk', 'present', 'manual', 'annot', 'corefer', 'relat', 'detail', 'corefer', 'resolut', 'experi', 'manual', 'annot', 'english', 'ontonot', 'pcedt', 'problemat', 'case', 'gener', 'premodifi', 'etc', 'di', 'agreement', 'corefer', 'chain', 'czech', 'english', 'russian']","['prednask', 'zamerim', 'detailnejs', 'popis', 'koreferenk', 'cest', 'predstavim', 'pro', 'anotak', 'vysledk', 'automatickeh', 'rozresen', 'koreferenk', 'srovnam', 'vysledk', 'mezianotatorsk', 'shod', 'zamerim', 'oreferencn', 'retezk', 'reprezentak', 'cest', 'jinych', 'jazyk']"
70,70,"The talk presents manual annotation of coreference and discourse relations in PDT in more detail: coreference resolution experiments, manual annotation (generics, premodifiers, etc.)), (dis)agreements, etc.","V přednášce jsme představili anotaci koreference a diskurzu v PDT s přihlednutím ke konkrétním problémům, jako je mezianotátorská shoda a příčiny neshod, koreference generických jmenných frází atd.","['talk', 'present', 'manual', 'annot', 'corefer', 'discours', 'relat', 'pdt', 'detail', 'corefer', 'resolut', 'experi', 'manual', 'annot', 'gener', 'premodifi', 'etc', 'di', 'agreement', 'etc']","['přednášk', 'představil', 'anotak', 'koreferenk', 'diskurz', 'pdt', 'přihlednu', 'konkrét', 'problém', 'mezianotátorsk', 'shod', 'přík', 'neshod', 'koreferenk', 'generick', 'jmenn', 'fráz', 'atd']"
71,71,"In the presentation, the general overview of textual phenomena annotated is presented. We discuss coreference, reconstruction of ellises, topic-focus articulation and discourse structure. ","V prezengtaci představujeme několik přístupu k analýze a anotace textových jevů, např. ke koreference, elipsám, aktualnímu cleneni a diskurzním konektorům a argumentům.","['present', 'gener', 'overview', 'textual', 'phenomena', 'annot', 'present', 'discuss', 'corefer', 'reconstruct', 'ellis', 'articul', 'discours', 'structur']","['prezengtak', 'představujem', 'několik', 'přístup', 'analýh', 'anotak', 'text', 'jev', 'koreferenk', 'elips', 'aktualním', 'clenen', 'diskurz', 'konektor', 'argument']"
72,72,"In the presentation, we analyzed contextually bound nominal expressions explicitly expressed in the sentence, that lack an anaphoric (bridging, coreference or segment) link to a previous context. The statistics collected from the PDT annotated data has shown that in almost one third of contextually bound expressions there is no anaphoric link to the previous context. Disregarding different types of more or less technical reasons evoked by the tectogrammatical structure of the PDT sentences and annotation errors, we can claim that there are three groups of reasons why contextually bound nominal groups are not linked by any anaphoric link. These are (i) contextually bound nominal groups semantically or pragmatically related to previous textual or extralinguistic context but not specified as bridging relations within the PDT; (ii) secondary circumstances (temporal, local, etc.) and (iii) nominal groups with low referential potential. ","V prezentaci jsme analyzovali výskyty kontextově zapojených výrazů ve větě, které nejsou propojeny žádným z anaforických vztahů (koreference, asociační anafora) anotatovaném v Pražském závislostním korpusu. Ukázalo se, že takových případů je v PDT cca. 30%. Vyčlenili jsme tři základní příčiny této absence: (i) kontextově zapojeny je sémanticky či pragmaticky spojen s s předchozím textem nebo s extralingvisticou situací; (ii) sekundární okolnosti, kulisy a (iii) výrazy s nízkým referenčním potenciálem.","['present', 'analyz', 'contextu', 'bound', 'nomin', 'express', 'explicitli', 'express', 'sentenc', 'lack', 'anaphor', 'bridg', 'corefer', 'segment', 'link', 'previou', 'context', 'statist', 'collect', 'pdt', 'annot', 'data', 'shown', 'almost', 'one', 'third', 'contextu', 'bound', 'express', 'anaphor', 'link', 'previou', 'context', 'disregard', 'differ', 'type', 'less', 'technic', 'reason', 'evok', 'tectogrammat', 'structur', 'pdt', 'sentenc', 'annot', 'error', 'claim', 'three', 'group', 'reason', 'contextu', 'bound', 'nomin', 'group', 'link', 'anaphor', 'link', 'contextu', 'bound', 'nomin', 'group', 'semant', 'pragmat', 'relat', 'previou', 'textual', 'extralinguist', 'context', 'specifi', 'bridg', 'relat', 'within', 'pdt', 'ii', 'secondari', 'circumst', 'tempor', 'local', 'etc', 'iii', 'nomin', 'group', 'low', 'referenti', 'potenti']","['prezentak', 'analyzoval', 'výskyt', 'kontext', 'zapojen', 'výraz', 'vět', 'propojen', 'žádn', 'anaforick', 'vztah', 'koreferenk', 'asociačn', 'anafor', 'anotatova', 'pražs', 'závislost', 'korpus', 'ukázal', 'takov', 'případ', 'pdt', 'cca', 'vyčlenil', 'základn', 'přík', 'absenk', 'kontext', 'zapojen', 'sémantick', 'pragmatick', 'spojen', 'předcho', 'text', 'extralingvistic', 'situac', 'ii', 'sekundárn', 'okolnost', 'kulis', 'iii', 'výraz', 'nízk', 'referenč', 'potenciál']"
73,73,"The present paper describes an attempt to create an interoperable scheme using existing annotations of textual phenomena across languages and genres including non-canonical ones. Such a kind of analysis requires annotated multilingual resources which are costly. Therefore, we make use of annotations already available in the resources for English, German and Czech. As the annotations in these corpora are based on different conceptual and methodological backgrounds, we need an interoperable scheme that covers existing categories and at the same time allows a comparison of the resources. In this paper, we describe how this interoperable scheme was created and which problematic cases we had to consider. The resulting scheme is supposed to be applied in the future to explore contrasts between the three languages under analysis, for which we expect the greatest differences in the degree of variation between non-canonical and canonical language. ","Daný článek popisuje pokus o vytvoření obecného anotačního schématu pomocí existujících anotací textových vztahů v češtině, němčině a angličtině.","['present', 'paper', 'describ', 'attempt', 'creat', 'interoper', 'scheme', 'use', 'exist', 'annot', 'textual', 'phenomena', 'across', 'languag', 'genr', 'includ', 'one', 'kind', 'analysi', 'requir', 'annot', 'multilingu', 'resourc', 'costli', 'therefor', 'make', 'use', 'annot', 'alreadi', 'avail', 'resourc', 'english', 'german', 'czech', 'annot', 'corpora', 'base', 'differ', 'conceptu', 'methodolog', 'background', 'need', 'interoper', 'scheme', 'cover', 'exist', 'categori', 'time', 'allow', 'comparison', 'resourc', 'paper', 'describ', 'interoper', 'scheme', 'creat', 'problemat', 'case', 'consid', 'result', 'scheme', 'suppos', 'appli', 'futur', 'explor', 'contrast', 'three', 'languag', 'analysi', 'expect', 'greatest', 'differ', 'degre', 'variat', 'canon', 'languag']","['dan', 'popisuj', 'pok', 'vytvořen', 'obecn', 'anotačn', 'schémat', 'pomoc', 'existujíc', 'anotac', 'text', 'vztah', 'česk', 'němk', 'anglick']"
74,74,"The aim of the present paper is to analyse contrasts in Czech, English and German in terms of discourse-relational devices (DRDs). The novelty of our approach lies in the nature of the resources we are using. Advantage is taken of existing resources, which are, however, annotated on the basis of two different frameworks. We use an interoperable scheme unifying DRDs of both frameworks in more abstract categories and considering only those phenomena that have a direct match in German, English and Czech.","Cílem výzkumu je statistické srovnání použití diskurzních konektorů v mluvené češtině, angličtině a němčině. Analýza se opírá na srovnatelné texty ve třech zkoumaných jazycích, na které byla promítnuta automatická anotace diskurzu vytvořena na základě srovnání anotačních schémat pro tyto jazyky, primárně provedena ručně v rámci různých vědeckých paradigmat. ","['aim', 'present', 'paper', 'analys', 'contrast', 'czech', 'english', 'german', 'term', 'devic', 'drd', 'novelti', 'approach', 'lie', 'natur', 'resourc', 'use', 'advantag', 'taken', 'exist', 'resourc', 'howev', 'annot', 'basi', 'two', 'differ', 'framework', 'use', 'interoper', 'scheme', 'unifi', 'drd', 'framework', 'abstract', 'categori', 'consid', 'phenomena', 'direct', 'match', 'german', 'english', 'czech']","['cíl', 'výzkum', 'statistick', 'srovnán', 'použit', 'diskurzn', 'konektor', 'mluven', 'česk', 'anglick', 'němk', 'analýz', 'opír', 'srovnateln', 'text', 'třech', 'zkouman', 'jazyc', 'promítnut', 'automatick', 'anotak', 'diskurz', 'vytvořen', 'základ', 'srovnán', 'anotačn', 'schém', 'jazyk', 'primárn', 'proveden', 'ručn', 'rámk', 'různ', 'vědeck', 'paradigm']"
75,75,"In the presentation, the two approaches to discourse-structuring devices have been compared and analysed: PDiT and GECCo","V této prezentaci jsme představili první výsledky srovnání dvou anotačních schémat, PDiT a GECCo v oblasti zpracování diskurzních konektorů.","['present', 'two', 'approach', 'devic', 'compar', 'analys', 'pdit', 'gecco']","['prezentak', 'představil', 'výsledk', 'srovnán', 'dvo', 'anotačn', 'schém', 'pdit', 'gecc', 'oblast', 'zpracován', 'diskurzn', 'konektor']"
76,76,"Tento článek je pilotní srovnavací výzkum koreferenčních řetězců v češtině, angličtině a ruštině. Podrobili jsme analýze 16 srovnatelných textů ve třech jazycích. Naší motivací bylo zjistit lingvistickou strukturu koreferenčních řetězců v těchto jazycích a určit, které faktory ovlivňují tuto strukturu.","This paper is a pilot comparative study on coreference chaining in three languages, namely, Czech, English and Russian. We have analyzed 16 parallel English-Czech newspaper texts and 16 texts in Russian (similar to the English-Czech ones in length and topics). Our motivation was to find out what the linguistic structure of coreference chains in different languages is and what types of distinctions we should take into account for advancing the development of systems for coreference resolution. Taking into account theoretical approaches to the phenomenon of coreference we based our research on the following assumption: the recognition of coreference links for different structural types of noun phrases is regulated by different language mechanisms. The other starting point was that different languages allow pronominal chaining of different length and that coreference chains properties differ for the languages with different strategies for zero anaphora and different systems for definiteness marking. This work reports our first findings within the task of the structural NP types’ distribution comparison in three languages under analysis.","['tento', 'článek', 'je', 'pilotní', 'srovnavací', 'výzkum', 'koreferenčních', 'řetězců', 'v', 'češtině', 'angličtině', 'ruštině', 'podrobili', 'jsme', 'analýz', 'srovnatelných', 'textů', 'třech', 'jazycích', 'naší', 'motivací', 'bylo', 'zjistit', 'lingvistick', 'strukturu', 'koreferenčních', 'řetězců', 'v', 'těchto', 'jazycích', 'určit', 'které', 'faktori', 'ovlivňují', 'tuto', 'strukturu']","['this', 'paper', 'is', 'pilot', 'comparativ', 'stud', 'coreferenk', 'chaining', 'in', 'thre', 'langua', 'namel', 'czech', 'english', 'and', 'russian', 'we', 'hav', 'analyzed', 'parallel', 'newspaper', 'texts', 'and', 'texts', 'in', 'russian', 'similar', 'the', 'ones', 'in', 'length', 'and', 'topics', 'our', 'motivation', 'was', 'find', 'out', 'what', 'the', 'linguistic', 'structur', 'of', 'coreferenk', 'chains', 'in', 'different', 'langua', 'is', 'and', 'what', 'ty', 'of', 'distinctions', 'we', 'should', 'int', 'account', 'for', 'advancing', 'the', 'development', 'of', 'systems', 'for', 'coreferenk', 'resolution', 'taking', 'int', 'account', 'theoretical', 'approac', 'the', 'phenomenon', 'of', 'coreferenk', 'we', 'based', 'our', 'research', 'the', 'following', 'assumption', 'the', 'recognition', 'of', 'coreferenk', 'links', 'for', 'different', 'structural', 'ty', 'of', 'noun', 'phra', 'is', 'regulated', 'different', 'languag', 'mechanisms', 'the', 'other', 'starting', 'point', 'was', 'that', 'different', 'langua', 'allow', 'pronominal', 'chaining', 'of', 'different', 'length', 'and', 'that', 'coreferenk', 'chains', 'propert', 'differ', 'for', 'the', 'langua', 'with', 'different', 'strateg', 'for', 'zer', 'anaphor', 'and', 'different', 'systems', 'for', 'definiteness', 'marking', 'this', 'work', 'reports', 'our', 'first', 'findings', 'with', 'the', 'task', 'of', 'the', 'structural', 'np', 'ty', 'distribution', 'comparison', 'in', 'thre', 'langua', 'under', 'analysis']"
77,77,"The title of the present publication suggests that it follows up the Encyclopedic Dictionary of Czech (2002) and its goals. However, it exceeds the previous dictionary in the extent, contents and form of the individual entries as well as the dictionary as a whole.","Titul předkládané publikace napovídá, že navazuje na Encyklopedický slovník češtiny (2002) a cíle, které si kladl. Rozsahem, obsahem a formou jednotlivých hesel i slovníku jako celku jej však přesahuje.","['titl', 'present', 'public', 'suggest', 'follow', 'encycloped', 'dictionari', 'czech', 'goal', 'howev', 'exce', 'previou', 'dictionari', 'extent', 'content', 'form', 'individu', 'entri', 'well', 'dictionari', 'whole']","['titul', 'předkládan', 'publikak', 'napovíd', 'navazuj', 'encyklopedick', 'slovník', 'česk', 'cíl', 'kladl', 'rozsah', 'obsah', 'form', 'jednotliv', 'hesel', 'slovník', 'celk', 'přesahuj']"
78,78,"In this paper, we present a method of improving quality of machine translation (MT) evaluation of Czech sentences via targeted paraphrasing of reference sentences on a deep syntactic layer. For this purpose, we employ NLP framework Treex and extend it with modules for targeted paraphrasing and word order changes. Automatic scores computed using these paraphrased reference sentences show higher correlation with human judgment than scores computed on the original reference sentences.",Představujeme vylepšení evaluace strojového překladu do češtiny pomocí cíleného parafrázování referenčních vět na rovině hloubkové syntaxe.,"['paper', 'present', 'method', 'improv', 'qualiti', 'machin', 'translat', 'mt', 'evalu', 'czech', 'sentenc', 'via', 'target', 'paraphras', 'refer', 'sentenc', 'deep', 'syntact', 'layer', 'purpos', 'employ', 'nlp', 'framework', 'treex', 'extend', 'modul', 'target', 'paraphras', 'word', 'order', 'chang', 'automat', 'score', 'comput', 'use', 'paraphras', 'refer', 'sentenc', 'show', 'higher', 'correl', 'human', 'judgment', 'score', 'comput', 'origin', 'refer', 'sentenc']","['představujem', 'vylepšen', 'evaluak', 'stroj', 'překlad', 'česk', 'pomoc', 'cílen', 'parafrázován', 'referenčn', 'vět', 'rovin', 'hloubk', 'syntax']"
79,79,"In this paper we will explore different approaches used in cross languages information retrieval (CLIR) systems, mainly dictionary-based and corpus based systems. Then we will focus on CLIR systems which use statistical machine translation (SMT) systems to translate queries into collection language. Different approaches which use SMT are studied in this paper including the using of SMT as black box and looking inside the box of the SMT system to tune it to get better performance in IR’s point of views rather than using SMT system to give better results for human’s point of views.","Článek se zabývá různými přístupy ke získávání informací napříč jazyky, zejména slovníkovými a korpusovými přístupy. Zaměříme se také na systémy, které používají statistický strojový překlad pro překládání dotazů nad kolekcí jazyků.","['paper', 'explor', 'differ', 'approach', 'use', 'cross', 'languag', 'inform', 'retriev', 'clir', 'system', 'mainli', 'corpu', 'base', 'system', 'focu', 'clir', 'system', 'use', 'statist', 'machin', 'translat', 'smt', 'system', 'translat', 'queri', 'collect', 'languag', 'differ', 'approach', 'use', 'smt', 'studi', 'paper', 'includ', 'use', 'smt', 'black', 'box', 'look', 'insid', 'box', 'smt', 'system', 'tune', 'get', 'better', 'perform', 'ir', 'point', 'view', 'rather', 'use', 'smt', 'system', 'give', 'better', 'result', 'human', 'point', 'view']","['zabýv', 'různ', 'přístup', 'získáván', 'informac', 'napříč', 'jazyk', 'zejmén', 'slovník', 'korpus', 'přístup', 'zaměřím', 'systém', 'používaj', 'statistick', 'stroj', 'překlad', 'překládán', 'dotaz', 'kolekc', 'jazyk']"
