,ID,EN,CZ,EN_tokens,CZ_tokens
137,137,"We compare two annotation styles, Prague dependencies and Universal Stanford Dependencies, in their adequacy for parsing. We specifically focus on comparing the adposition attachment style, used in these two formalisms, applied in multi-source cross-lingual delexicalized dependency parser transfer performed by parse tree combination. We show that in our setting, converting the adposition annotation to Stanford style in the Prague style training treebanks leads to promising results. We find that best results can be obtained by parsing the target sentences with parsers trained on treebanks using both of the adposition annotation styles in parallel, and combining all the resulting parse trees together after having converted them to the Stanford adposition style (+0.39% UAS over Prague style baseline). The score improvements are considerably more significant when using a smaller set of diverse source treebanks (up to +2.24% UAS over the baseline). "," Porovnáváme dva anotační styly, Pražské závislosti a univerzální Stanfordské závislosti, ve smyslu jejich vhodnosti pro parsing. Konkrétně se zaměřujeme na porovnání stylu zavěšení adpozic, použivaného v těchto dvou formalismech, na úloze vícezdrojového mezijazyčného přenosu delexikalizovaného parseru, používajíce MSTParser. Zjišťujeme, že v našem scénáři se stává zřetelnou výhoda Stanfordského stylu, neboť převod anotace adpozic v treebancích anotovaných v Pražském stylu do Stanfordského stylu vede k mírně lepšímu výsledku (+0.2% UAS). Dále ukazujeme, že nejlepších výsledků lze dosáhnout pomocí natrénování parserů na treebancích využívajících oba styly anotace adpozic, analýzy cílového treebanku pomocí všech těchto parserů a kombinace všech získaných stromů, po jejich převodu do stejného anotačního stylu (dalších +0.18% UAS). Rozdíly ve skóre jsou ještě vyšší, když se použije menší sada různorodých zdrojových treebanků (až 2.24% UAS oproti základní verzi). ","['compar', 'two', 'annot', 'style', 'pragu', 'depend', 'univers', 'stanford', 'depend', 'adequaci', 'pars', 'specif', 'focu', 'compar', 'adposit', 'attach', 'style', 'use', 'two', 'formal', 'appli', 'delexic', 'depend', 'parser', 'transfer', 'perform', 'pars', 'tree', 'combin', 'show', 'set', 'convert', 'adposit', 'annot', 'stanford', 'style', 'pragu', 'style', 'train', 'treebank', 'lead', 'promis', 'result', 'find', 'best', 'result', 'obtain', 'pars', 'target', 'sentenc', 'parser', 'train', 'treebank', 'use', 'adposit', 'annot', 'style', 'parallel', 'combin', 'result', 'pars', 'tree', 'togeth', 'convert', 'stanford', 'adposit', 'style', 'ua', 'pragu', 'style', 'baselin', 'score', 'improv', 'consider', 'signific', 'use', 'smaller', 'set', 'divers', 'sourc', 'treebank', 'ua', 'baselin']","['porovnávám', 'anotačn', 'styl', 'pražsk', 'závislost', 'univerzáln', 'stanfordsk', 'závislost', 'smysl', 'vhodnost', 'parsing', 'konkrétn', 'zaměřujem', 'porovnán', 'styl', 'zavěšen', 'adpozic', 'použivan', 'těcht', 'dvo', 'formalism', 'úloh', 'vícezdroj', 'mezijazyčn', 'přenos', 'delexikalizovan', 'parser', 'používajík', 'mstparser', 'zjišťujem', 'naš', 'scénář', 'stáv', 'zřeteln', 'výhod', 'stanfordsk', 'styl', 'neboť', 'převod', 'anotak', 'adpozic', 'treebanc', 'anotovan', 'pražs', 'styl', 'stanfordsk', 'styl', 'ved', 'mírn', 'lepším', 'výsledk', 'uas', 'ukazujem', 'nejlepš', 'výsledk', 'lze', 'dosáhnout', 'pomoc', 'natrénován', 'parser', 'treebanc', 'využívajíc', 'oba', 'styl', 'anotak', 'adpozic', 'analýz', 'cílov', 'treebank', 'pomoc', 'všech', 'těcht', 'parser', 'kombinak', 'všech', 'získan', 'strom', 'převod', 'stejn', 'anotačn', 'styl', 'dalš', 'uas', 'rozdíl', 'skór', 'vyšš', 'použij', 'menš', 'sad', 'různorod', 'zdroj', 'treebank', 'uas', 'oprot', 'základn', 'verh']"
138,138,"We present our work on semi-supervised parsing of natural language sentences, focusing on multi-source crosslingual transfer of delexicalized dependency parsers. We first evaluate the influence of treebank annotation styles on parsing performance, focusing on adposition attachment style. Then, we present KLcpos3, an empirical language similarity measure, designed and tuned for source parser weighting in multi-source delexicalized parser transfer. And finally, we introduce a novel resource combination method, based on interpolation of trained parser models. ","Představujeme naši práci v oblasti částečně řízené syntaktické analýzy vět přirozeného jazyka, se zaměřením na mezijazyčný přenos delexicalizovaných závislostních parserů s více zdroji. Nejprve vyhodnocujeme vliv anotačního stylu treebanku na úspěšnost parsingu, se zaměřením na styl zavěšení adpozic. Poté představujeme KLcpos3, empirickou míru podobnosti jazyků, navrženou a vyladěnou pro vážení zdrojových parserů při přenosu delexicalizovaných parserů s více zdroji. Nakonec představíme novou metodu kombinace zdrojů, založenou na interpolaci natrénovaných modelů parserů.","['present', 'work', 'pars', 'natur', 'languag', 'sentenc', 'focus', 'crosslingu', 'transfer', 'delexic', 'depend', 'parser', 'first', 'evalu', 'influenc', 'treebank', 'annot', 'style', 'pars', 'perform', 'focus', 'adposit', 'attach', 'style', 'present', 'klcpos3', 'empir', 'languag', 'similar', 'measur', 'design', 'tune', 'sourc', 'parser', 'weight', 'delexic', 'parser', 'transfer', 'final', 'introduc', 'novel', 'resourc', 'combin', 'method', 'base', 'interpol', 'train', 'parser', 'model']","['představujem', 'prák', 'oblast', 'částečn', 'řízen', 'syntaktick', 'analýz', 'vět', 'přirozen', 'jazyk', 'zaměře', 'mezijazyčn', 'přen', 'delexicalizovan', 'závislostn', 'parser', 'zdroj', 'nejprv', 'vyhodnocujem', 'vliv', 'anotačn', 'styl', 'treebank', 'úspěšnost', 'parsing', 'zaměře', 'styl', 'zavěšen', 'adpozic', 'pot', 'představujem', 'klcpos3', 'empirick', 'mír', 'podobnost', 'jazyk', 'navržen', 'vyladěn', 'vážen', 'zdroj', 'parser', 'přenos', 'delexicalizovan', 'parser', 'zdroj', 'nakonec', 'představím', 'nov', 'metod', 'kombinak', 'zdroj', 'založen', 'interpolak', 'natrénovan', 'model', 'parser']"
139,139,"We present an implementation of domain adaptation by translation model interpolation in the TectoMT translation system with deep transfer. We evaluate the method on six language pairs with a 1000-sentence in-domain parallel corpus, and obtain improvements of up to 3 BLEU points. The interpolation weights are set uniformly, without employing any tuning.","Představujeme implementaci doménové adaptace pomocí interpolace překladových modelů v TectoMT, překladovém systému s hloubkovým transferem. Vyhodnotili jsme tuto metodu na šesti jazykových párech s doménovým paralelním korpusem o 1000 větách, a získali jsme zlepšení až o 3 body BLEU. Váhy pro interpolaci jsou nastaveny uniformně, bez zapojení jakéhokoliv ladění.","['present', 'implement', 'domain', 'adapt', 'translat', 'model', 'interpol', 'tectomt', 'translat', 'system', 'deep', 'transfer', 'evalu', 'method', 'six', 'languag', 'pair', 'parallel', 'corpu', 'obtain', 'improv', 'bleu', 'point', 'interpol', 'weight', 'set', 'uniformli', 'without', 'employ', 'tune']","['představujem', 'implementak', 'domén', 'adaptak', 'pomoc', 'interpolak', 'překlad', 'model', 'tectomt', 'překlado', 'syst', 'hloubk', 'transfer', 'vyhodnotil', 'metod', 'šest', 'jazyk', 'pár', 'domén', 'paralel', 'korpus', 'vět', 'získal', 'zlepšen', 'bod', 'ble', 'váh', 'interpolak', 'nastaven', 'uniformn', 'zapojen', 'jakéhokoliv', 'laděn']"
140,140,"We present KLcpos3, a language similarity measure based on Kullback-Leibler divergence of coarse part-of-speech tag trigram distributions in tagged corpora. It has been designed for multilingual delexicalized parsing, both for source treebank selection in single-source parser transfer, and for source treebank weighting in multi-source transfer. In the selection task, KLcpos3 identifies the best source treebank in 8 out of 18 cases. In the weighting task, it brings +4.5% UAS absolute, compared to unweighted parse tree combination.","Představujeme KLcpos3, míru podobnosti jazyků založenou na Kullbackově-Leiblerově divergenci rozložení trigramů hrubých značek slovních druhů v otagovaných korpusech. Tato míra byla navržena pro vícejazyčný delexicalizovaný parsing, a to jak pro výběr zdrojového treebanku při přenosu parseru s jedním zdrojem, tak pro vážení zdrojových treebanků při přenosu parseru s více zdroji. V úloze výběru zdroje rozpozná KLcpos3 nejlepší zdrojový treebank v 8 z 18 případů. V úloze vážení zdroje přínáší zvýšení UAS o +4.5 procentního bodu oproti nevážené kombinaci stromů.","['present', 'klcpos3', 'languag', 'similar', 'measur', 'base', 'diverg', 'coars', 'tag', 'trigram', 'distribut', 'tag', 'corpora', 'design', 'multilingu', 'delexic', 'pars', 'sourc', 'treebank', 'select', 'parser', 'transfer', 'sourc', 'treebank', 'weight', 'transfer', 'select', 'task', 'klcpos3', 'identifi', 'best', 'sourc', 'treebank', 'case', 'weight', 'task', 'bring', 'ua', 'absolut', 'compar', 'unweight', 'pars', 'tree', 'combin']","['představujem', 'klcpos3', 'mír', 'podobnost', 'jazyk', 'založen', 'divergenk', 'rozložen', 'trigram', 'hrub', 'značek', 'slovn', 'druh', 'otagovan', 'korpus', 'mír', 'navržen', 'vícejazyčn', 'delexicalizovan', 'parsing', 'výběr', 'zdroj', 'treebank', 'přenos', 'parser', 'jed', 'zdroj', 'vážen', 'zdroj', 'treebank', 'přenos', 'parser', 'zdroj', 'úloh', 'výběr', 'zdroj', 'rozpozn', 'klcpos3', 'nejlepš', 'zdroj', 'treebank', 'případ', 'úloh', 'vážen', 'zdroj', 'přínáš', 'zvýšen', 'uas', 'procentn', 'bod', 'oprot', 'nevážen', 'kombinak', 'strom']"
141,141,"We introduce interpolation of trained MSTParser models as a resource combination method for multi-source delexicalized parser transfer. We present both an unweighted method, as well as a variant in which each source model is weighted by the similarity of the source language to the target language. Evaluation on the HamleDT treebank collection shows that theweightedmodelinterpolationperforms comparably to weighted parse tree combination method, while being computationally much less demanding. ","Představujeme interpolaci natrénovaných modelů MSTParseru jako metodu kombinace zdrojů pro vícezdrojový delexikalizovaný přenos parseru. Představujeme jak neváženou metodu, tak variantu ve které je každý zdrojový model vážen podobností zdrojového a cílového jazyka. Vyhodnocení na sbírce treebanků HamleDT ukazuje, že vážená interpolace modelů má podobnou úspěšnost jako vážená kombinace stromů, přičemž je mnohem méně komputačně náročná.","['introduc', 'interpol', 'train', 'mstparser', 'model', 'resourc', 'combin', 'method', 'delexic', 'parser', 'transfer', 'present', 'unweight', 'method', 'well', 'variant', 'sourc', 'model', 'weight', 'similar', 'sourc', 'languag', 'target', 'languag', 'evalu', 'hamledt', 'treebank', 'collect', 'show', 'theweightedmodelinterpolationperform', 'compar', 'weight', 'pars', 'tree', 'combin', 'method', 'comput', 'much', 'less', 'demand']","['představujem', 'interpolak', 'natrénovan', 'model', 'mstparser', 'metod', 'kombinak', 'zdroj', 'vícezdroj', 'delexikalizovan', 'přen', 'parser', 'představujem', 'nevážen', 'metod', 'variant', 'zdroj', 'model', 'vážen', 'podobnost', 'zdroj', 'cílov', 'jazyk', 'vyhodnocen', 'sbírk', 'treebank', 'hamledt', 'ukazuj', 'vážen', 'interpolak', 'model', 'podobn', 'úspěšnost', 'vážen', 'kombinak', 'strom', 'přičemž', 'mnoh', 'mén', 'komputačn', 'náročn']"
142,142,"This paper is devoted to three topics concerning my first year postgraduate studies at UFAL. First, I will present the current state-of-the-art of coreference resolution in the Czech and English language. Next, I will describe a method of extraction of numerical expressions linked to certain entities with the GATE tool and the last part will be dedicated to the Capek sentence diagramming editor and a method of getting more annotated data from sentence diagrams.","Článek je zaměřen na tři témate související s autorčiným prvním rokem doktorského studia. Zaprvé, zabývá se nástroji pro rozpoznávání koreference v češtině a angličtině. Zadruhé, popisuje metody extrakce číselných výrazů napojených na vybrané typy entit v prostředí GATE. Poslední část je věnovaná editoru Capek a získávání anotovaných větných diagramů","['paper', 'devot', 'three', 'topic', 'concern', 'first', 'year', 'postgradu', 'studi', 'ufal', 'first', 'present', 'current', 'corefer', 'resolut', 'czech', 'english', 'languag', 'next', 'describ', 'method', 'extract', 'numer', 'express', 'link', 'certain', 'entiti', 'gate', 'tool', 'last', 'part', 'dedic', 'capek', 'sentenc', 'diagram', 'editor', 'method', 'get', 'annot', 'data', 'sentenc', 'diagram']","['zaměřen', 'témat', 'souvisejíc', 'autork', 'prv', 'rok', 'doktorsk', 'studi', 'zaprv', 'zabýv', 'nástroj', 'rozpoznáván', 'koreferenk', 'česk', 'anglick', 'zadruh', 'popisuj', 'metod', 'extrakk', 'číseln', 'výraz', 'napojen', 'vybran', 'typ', 'entit', 'prostřed', 'gat', 'posledn', 'část', 'věnovan', 'editor', 'capek', 'získáván', 'anotovan', 'větn', 'diagram']"
143,143,"Environmental impact assessment (EIA) is the formal process used to predict the environmental consequences of a plan. We present a rule-based extraction system for mining Czech EIA documents. The extraction rules work with a set of documents enriched with morphological information and with manually created vocabularies of terms supposed to be extracted from the documents, e.g. basic information about the project (address, ID company, ...), data on the impacts and outcomes (waste substances, endangered species, ...), a final opinion. The document Notice of Intent contains the section BI2 with the information on the scope (capacity) of the plan.","EIA (Environmental Impact Assessment) je proces, při kterém se posuzují vlivy stavby, tzv. záměru, na životní prostředí, a následně se vyhodnotí, zda-li bude záměr povolen, příp. za jakých podmínek je jeho realizace akceptovatelná. Předkládáme extrakční pravidlový systém, který automaticky vytěžuje záměry v českém systému EIA. Extrakční pravidla pracují s texty záměrů (Oznámení záměru, Stanovisko, Stanovisko Natura), automaticky obohacenými o tvaroslovné informace a s ručně vytvořenými slovníky pojmů určených k vytěžení, např: základní údaje o záměru (adresa, IČO společnosti, …), údaje o vlivech a výstupech (odpadové látky, ohrožené druhy, …), závěrečné stanovisko. V dokumentech Oznámení záměru je nejdůležitější sekce B.I.2, která obsahuje informace o rozsahu (kapacitě) záměru. ","['environment', 'impact', 'assess', 'eia', 'formal', 'process', 'use', 'predict', 'environment', 'consequ', 'plan', 'present', 'extract', 'system', 'mine', 'czech', 'eia', 'document', 'extract', 'rule', 'work', 'set', 'document', 'enrich', 'morpholog', 'inform', 'manual', 'creat', 'vocabulari', 'term', 'suppos', 'extract', 'document', 'basic', 'inform', 'project', 'address', 'id', 'compani', 'data', 'impact', 'outcom', 'wast', 'substanc', 'endang', 'speci', 'final', 'opinion', 'document', 'notic', 'intent', 'contain', 'section', 'bi2', 'inform', 'scope', 'capac', 'plan']","['eia', 'environmental', 'impact', 'assessment', 'pro', 'kte', 'posuzuj', 'vliv', 'stavb', 'záměr', 'životn', 'prostřed', 'následn', 'vyhodnot', 'záměr', 'povolen', 'příp', 'jak', 'podmínek', 'realizak', 'akceptovateln', 'předkládám', 'extrakčn', 'pravidl', 'sys', 'automatick', 'vytěžuj', 'záměr', 'čes', 'syst', 'eia', 'extrakčn', 'pravidl', 'pracuj', 'text', 'záměr', 'oznámen', 'záměr', 'stanovisk', 'stanovisk', 'natur', 'automatick', 'obohacen', 'tvaroslovn', 'informak', 'ručn', 'vytvořen', 'slovník', 'pojm', 'určen', 'vytěžen', 'např', 'základn', 'údaj', 'záměr', 'adres', 'ičo', 'společnost', 'údaj', 'vliv', 'výstup', 'odpad', 'látk', 'ohrožen', 'druh', 'závěrečn', 'stanovisk', 'dokument', 'oznámen', 'záměr', 'nejdůležitějš', 'sekk', 'obsahuj', 'informak', 'rozsah', 'kapacit', 'záměr']"
144,144,"This work focuses on using anaphora for machine translation with deep-syntactic transfer. We compare multiple coreference resolvers for English in terms of how they affect the quality of pronoun translation in English-Czech and English-Dutch machine translation systems with deep transfer. We examine which pronouns in the target language depend on anaphoric information, and design rules that take advantage of this information. The resolvers’ performance measured by translation quality is contrasted with their intrinsic evaluation results. In addition, a more detailed manual analysis of English-to-Czech translation was carried out.",Tato práce porovnává několik systémů pro rozpoznávání koreference v angličtině v překladu přes hloubkovou syntax z angličtiny do češtiny a holandštiny.,"['work', 'focus', 'use', 'anaphora', 'machin', 'translat', 'transfer', 'compar', 'multipl', 'corefer', 'resolv', 'english', 'term', 'affect', 'qualiti', 'pronoun', 'translat', 'machin', 'translat', 'system', 'deep', 'transfer', 'examin', 'pronoun', 'target', 'languag', 'depend', 'anaphor', 'inform', 'design', 'rule', 'take', 'advantag', 'inform', 'resolv', 'perform', 'measur', 'translat', 'qualiti', 'contrast', 'intrins', 'evalu', 'result', 'addit', 'detail', 'manual', 'analysi', 'translat', 'carri']","['prák', 'porovnáv', 'několik', 'systém', 'rozpoznáván', 'koreferenk', 'anglick', 'překlad', 'hloubk', 'syntax', 'anglick', 'česk', 'holandsk']"
145,145,"In this talk, we present a comprehensive study on mappings between certain classes of coreferential expressions in English and Czech. We focused on central pronouns, relative pronouns and anaphoric zeros. For instance, the English sentence ""It switched to a caffeine-free formula using its new Coke in 1985"" has been in PCEDT translated to ""V roce 1985 přešla na bezkofeinovou recepturu, kterou používá pro svojí novou kolu"". This pair of sentences exhibits several types of changes in expressing coreference: English personal pronouns turns into a Czech zero, possessive pronoun into a possessive reflexive and finally, the -ing participle has been translated to a relative clause. In a similar manner, we have collected a statistics of mappings from a subsection of PCEDT, which we will support by multiple examples and contrast with the theoretical assumptions. For such a study, the quality of word alignment is crucial. Thus, we designed a rule-based refining algorithm for English personal and possessive pronouns and Czech relative pronouns, which served as an automatic alignment pre-annotation. Subsequently, this annotation has been manually corrected and completed, obtaining a basis for this empirical study.","V teto prednasce predstavujeme srovnani koreferencnich vyrazu v cestine a anglictine na zaklade paralelnich dat Prazskeho anglicko-ceskeho zavislostniho korpusu. V centru naseho vyzkumu jsou osobni, privlastnovaci, reflexivni a vztazna zajmena. Zvlastni pozornost venujeme rovnez vynechani zajmen v anaforicke pozici.","['talk', 'present', 'comprehens', 'studi', 'map', 'certain', 'class', 'coreferenti', 'express', 'english', 'czech', 'focus', 'central', 'pronoun', 'rel', 'pronoun', 'anaphor', 'zero', 'instanc', 'english', 'sentenc', 'switch', 'formula', 'use', 'new', 'coke', 'pcedt', 'translat', 'v', 'roce', 'přešla', 'na', 'bezkofeinov', 'recepturu', 'kterou', 'používá', 'pro', 'svojí', 'novou', 'kolu', 'pair', 'sentenc', 'exhibit', 'sever', 'type', 'chang', 'express', 'corefer', 'english', 'person', 'pronoun', 'turn', 'czech', 'zero', 'possess', 'pronoun', 'possess', 'reflex', 'final', 'participl', 'translat', 'rel', 'claus', 'similar', 'manner', 'collect', 'statist', 'map', 'subsect', 'pcedt', 'support', 'multipl', 'exampl', 'contrast', 'theoret', 'assumpt', 'studi', 'qualiti', 'word', 'align', 'crucial', 'thu', 'design', 'refin', 'algorithm', 'english', 'person', 'possess', 'pronoun', 'czech', 'rel', 'pronoun', 'serv', 'automat', 'align', 'subsequ', 'annot', 'manual', 'correct', 'complet', 'obtain', 'basi', 'empir', 'studi']","['prednask', 'predstavujem', 'srovnan', 'koreferencn', 'vyraz', 'cest', 'anglict', 'zaklad', 'paraleln', 'dat', 'prazskeh', 'zavislostn', 'korpus', 'centr', 'naseh', 'vyzkum', 'osobn', 'privlastnovak', 'reflexivn', 'vztazn', 'zajmen', 'zvlastn', 'pozornost', 'venujem', 'rovnez', 'vynechan', 'zajmen', 'anaforick', 'pozik']"
146,146,"V této práci představujeme podrobný srovnávací výzkum některých typů koreferenčních vztahů v češtině a angličtině na paralelním česko-anglickém korpusu. Zaměřujeme se na centrální, vztažná a anaforická zájmena. Vypracovali jsme algoritmus vylepšení automatického vyrovnání několika typů českých a anglických zájmen, který vylepšuje kvalitu vyrovnání nejen pro tyto typy ale a pro všechny ostatní. Korespondence daných typů zájmen byly anatovány ručně a dále lingvisticky analyzovány.","In this work, we present a comprehensive study on correspondences between certain classes of coreferential expressions in English and Czech. We focus on central pronouns, relative pronouns, and anaphoric zeros. We designed an alignment-refining algorithm for English personal and possessive pronouns and Czech relative pronouns that improves the quality of alignment links not only for the classes it aimed at but also in general. Moreover, the instances of anaphoric expressions we focus on were manually annotated with their alignment counterparts, which served as a basis for this empirical study. The collected statistics of correspondences are contrasted with theoretical assumptions regarding the use of anaphoric means in the languages under analysis, such as pro-drop properties, the use of finite and non-finite constructions, etc. Finally, we present the ways how the observed correspondences can be exploited in cross-lingual coreference resolution.","['v', 'této', 'práci', 'představujem', 'podrobný', 'srovnávací', 'výzkum', 'některých', 'typů', 'koreferenčních', 'vztahů', 'v', 'češtině', 'angličtině', 'na', 'paralelním', 'korpusu', 'zaměřujem', 'se', 'na', 'centrální', 'vztažná', 'anaforická', 'zájmena', 'vypracovali', 'jsme', 'algoritmu', 'vylepšení', 'automatického', 'vyrovnání', 'několika', 'typů', 'českých', 'anglických', 'zájmen', 'který', 'vylepšuj', 'kvalitu', 'vyrovnání', 'nejen', 'pro', 'tyto', 'typi', 'ale', 'pro', 'všechni', 'ostatní', 'korespond', 'daných', 'typů', 'zájmen', 'byli', 'anatováni', 'ručně', 'dále', 'lingvisticki', 'analyzováni']","['in', 'this', 'work', 'we', 'present', 'comprehensiv', 'stud', 'corresponden', 'between', 'certa', 'clas', 'of', 'coreferential', 'expressions', 'in', 'english', 'and', 'czech', 'we', 'foc', 'central', 'pronouns', 'relativ', 'pronouns', 'and', 'anaphoric', 'zer', 'we', 'designed', 'an', 'algorithm', 'for', 'english', 'personal', 'and', 'possessiv', 'pronouns', 'and', 'czech', 'relativ', 'pronouns', 'that', 'impro', 'the', 'qualit', 'of', 'alignment', 'links', 'not', 'onl', 'for', 'the', 'clas', 'it', 'aimed', 'at', 'but', 'als', 'in', 'general', 'moreover', 'the', 'instan', 'of', 'anaphoric', 'expressions', 'we', 'foc', 'wer', 'manuall', 'annotated', 'with', 'their', 'alignment', 'counterparts', 'which', 'served', 'as', 'basis', 'for', 'this', 'empirical', 'stud', 'the', 'collected', 'statistics', 'of', 'corresponden', 'are', 'contrasted', 'with', 'theoretical', 'assumptions', 'regarding', 'the', 'use', 'of', 'anaphoric', 'means', 'in', 'the', 'langua', 'under', 'analysis', 'such', 'as', 'propert', 'the', 'use', 'of', 'finit', 'and', 'constructions', 'finall', 'we', 'present', 'the', 'ways', 'how', 'the', 'observed', 'corresponden', 'can', 'be', 'exploited', 'in', 'coreferenk', 'resolution']"
